{
  "schema_version": 1,
  "condition": "native",
  "repository": "rest_proxy",
  "revision": "b05363c4b43df110f749a0a238fc0589bd76a49f",
  "index_state": "not_applicable",
  "setup_seconds": 0,
  "token_measurement": "estimated",
  "elapsed_measurement": "end_to_end",
  "measurement_notes": "Native-only source inspection pilot, 15 sequential cases in one agent session; shared context and filesystem caches are not reset. elapsed_seconds is actual Date.now wall time from first case search to recorded answer, including reasoning and orchestration. Setup protocol reads were not timed and setup_seconds=0 means no indexing/setup was performed, not zero protocol overhead. Per-case token estimates are ceil((captured tool output characters + command characters)/4) input and ceil(answer characters/4) output; they are NOT total model/billed tokens and exclude inherited context, repeated context, reasoning and orchestration. No per-case model telemetry API was available. Tool calls count executed native inspection shell invocations including failed searches. files_opened counts unique existing source files whose content appeared in command output, including exact search excerpts; failed paths and protocol files excluded. native_fallback_calls=0 because native is the assigned baseline, not a fallback. Correctness is source-based self-assessment, not independent grading. See native-transcript.json for full command/output and timestamps.",
  "runs": [
    {
      "case_id": "http_mcp_startup",
      "correct": true,
      "unsupported_claims": 0,
      "elapsed_seconds": 29.677,
      "tool_calls": 3,
      "files_opened": 2,
      "input_tokens": 3185,
      "output_tokens": 143,
      "evidence": [
        "_mcp.py:13",
        "_mcp.py:21",
        "_mcp.py:24",
        "brain_server.py:147",
        "brain_server.py:177",
        "brain_server.py:279",
        "brain_server.py:332",
        "brain_server.py:349"
      ],
      "answer": "brain_server imports the shared mcp singleton; _mcp loads environment, creates stateful FastMCP and calls register_all(mcp). The Starlette lifespan registers the job loop, best-effort opens the DB pool, loads watched projects and starts the watcher, then runs the MCP session manager; shutdown stops watcher and closes pool. Root and /health precede the root-mounted MCP app (/mcp) and return online status, protocol/tool count, boot/fingerprint, uptime and session diagnostics. /fingerprint exposes identity diagnostics. Direct execution starts Uvicorn on 127.0.0.1:8001.",
      "notes": "Self-assessed from inspected source; not independently graded. Token fields are estimates: input=ceil((tool-output characters + command characters)/4), output=ceil(answer characters/4), excluding inherited context, reasoning, and orchestration. See native-notes.md.",
      "native_fallback_calls": 0
    },
    {
      "case_id": "proxy_chat_flow",
      "correct": true,
      "unsupported_claims": 0,
      "elapsed_seconds": 24.233,
      "tool_calls": 4,
      "files_opened": 5,
      "input_tokens": 3565,
      "output_tokens": 172,
      "evidence": [
        "proxy/app.py:165",
        "proxy/app.py:214",
        "proxy/app.py:256",
        "proxy/app.py:292",
        "proxy/handlers_responses.py:164",
        "proxy/handlers_responses.py:186",
        "proxy/handlers_responses.py:231",
        "proxy/handlers_responses.py:249",
        "proxy/handlers_chat.py:61"
      ],
      "answer": "The FastAPI POST route parses JSON, strips stream_options/stop, optionally fetches model keys and resolves aliases, injects codebase_search into tools, and on the tools path filters messages, optionally injects memory and breaks tool loops. Both branches call forward_responses_api_completion with raw history for tracking. That function looks up a resp_ previous ID by history hash, sends only the latest message when continuing or full history otherwise, builds model/input/stream/tools/instructions, and for non-streaming posts via httpx.AsyncClient to OPENAI_BASE/responses. HTTP rejection falls back to forward_openai_chat_completion, whose upstream is OPENAI_BASE/chat/completions.",
      "notes": "Self-assessed from inspected source; not independently graded. Token fields are estimates: input=ceil((tool-output characters + command characters)/4), output=ceil(answer characters/4), excluding inherited context, reasoning, and orchestration. See native-notes.md.",
      "native_fallback_calls": 0
    },
    {
      "case_id": "memory_mode_gating",
      "correct": true,
      "unsupported_claims": 0,
      "elapsed_seconds": 15.787,
      "tool_calls": 2,
      "files_opened": 1,
      "input_tokens": 1436,
      "output_tokens": 167,
      "evidence": [
        "proxy/config.py:10",
        "proxy/config.py:22",
        "proxy/config.py:35",
        "proxy/config.py:49",
        "proxy/config.py:64"
      ],
      "answer": "After dotenv load, LM_PROXY_MEMORY_ENABLED is the master flag (default true). LM_PROXY_MEMORY_MODE defaults stateless, normalized to off; assist aliases are assistant/summary/local/small, full aliases stateful/enabled/hybrid, unknown values off. Persistence, Redis and injection require master enabled AND assist/full AND their respective LM_PROXY_MEMORY_ENABLE_PERSISTENCE, ENABLE_REDIS, ENABLE_INJECT flags (all default true). Embeddings require master enabled AND full AND ENABLE_EMBEDDINGS (default false). Thus default effective memory functions are off. Missing optional imports reset module references to None, and request paths must also check availability.",
      "notes": "Self-assessed from inspected source; not independently graded. Token fields are estimates: input=ceil((tool-output characters + command characters)/4), output=ceil(answer characters/4), excluding inherited context, reasoning, and orchestration. See native-notes.md.",
      "native_fallback_calls": 0
    },
    {
      "case_id": "index_job_recovery",
      "correct": true,
      "unsupported_claims": 0,
      "elapsed_seconds": 14.855,
      "tool_calls": 2,
      "files_opened": 1,
      "input_tokens": 3318,
      "output_tokens": 181,
      "evidence": [
        "_jobs.py:147",
        "_jobs.py:180",
        "_jobs.py:210",
        "_jobs.py:248",
        "_jobs.py:479",
        "_jobs.py:489",
        "_jobs.py:868",
        "_jobs.py:913"
      ],
      "answer": "Each job persists serializable status, phase return codes/PIDs, log paths, timestamps and maintenance state to its runtime job directory/state.json using a unique temporary JSON file and atomic replace. load_job_record consults memory then disk; running/cancelling records are loaded into cache and reconciled. Reconciliation polls surviving Popen objects or tests saved PIDs with kill(pid,0); a dead PID gets a return code inferred from completion/error log text, otherwise failure. Once both phases finish it records cancelled/done/failed, removes the manifest, releases project/capacity locks, persists, and runs unfinished maintenance. This is bookkeeping recovery, not automatic re-execution of the indexing workload.",
      "notes": "Self-assessed from inspected source; not independently graded. Token fields are estimates: input=ceil((tool-output characters + command characters)/4), output=ceil(answer characters/4), excluding inherited context, reasoning, and orchestration. See native-notes.md.",
      "native_fallback_calls": 0
    },
    {
      "case_id": "semantic_search_ranking",
      "correct": true,
      "unsupported_claims": 0,
      "elapsed_seconds": 25.088,
      "tool_calls": 3,
      "files_opened": 3,
      "input_tokens": 7856,
      "output_tokens": 208,
      "evidence": [
        "memory/code_retrieval.py:93",
        "memory/code_retrieval.py:160",
        "memory/code_retrieval.py:196",
        "memory/code_retrieval.py:328",
        "memory/retrieval_policy.py:61",
        "memory/retrieval_scoring.py:104",
        "memory/code_retrieval.py:487",
        "memory/code_retrieval.py:522",
        "memory/code_retrieval.py:618",
        "memory/code_retrieval.py:648"
      ],
      "answer": "search_codebase_core resolves projects and intent/path/member hints, then queries each project's embeddings with vector rank plus full-text rank, weighted RRF 2/(60+semantic rank)+1/(60+keyword rank). Empty candidates may be rescued by runtime/path hints, otherwise return empty. Metadata/path/crate filters and metadata boosts apply; implementation policy uses scoring helpers for symbols, definitions, paths and entrypoints, while ordinary ranking penalizes docs/parser/binding surfaces. Definition/path and exact member usage grep can rescue indexed rows when leading results miss the intended target. Optional clone dedup and duplicate-aware postprocessing precede file/directory caps and top-k. The final grep supplement runs only when enabled and nonempty top results have low file diversity; broad mode enables it by default.",
      "notes": "Self-assessed from inspected source; not independently graded. Token fields are estimates: input=ceil((tool-output characters + command characters)/4), output=ceil(answer characters/4), excluding inherited context, reasoning, and orchestration. See native-notes.md.",
      "native_fallback_calls": 0
    },
    {
      "case_id": "duplicate_suppression",
      "correct": true,
      "unsupported_claims": 0,
      "elapsed_seconds": 15.498,
      "tool_calls": 2,
      "files_opened": 2,
      "input_tokens": 5292,
      "output_tokens": 188,
      "evidence": [
        "memory/retrieval_duplicates.py:441",
        "memory/retrieval_duplicates.py:600",
        "memory/retrieval_duplicates.py:640",
        "memory/code_retrieval_postprocess.py:39"
      ],